{
  "invoiceId": "INV-D4E5F6A7-4567-89AB-CDEF-012345678901",
  "invoiceNumber": "2024-0004",
  "customerName": "Schmidt Immobilien GmbH",
  "customerEmail": "info@schmidt-immobilien.de",
  "customerAddress": {
    "street": "Hauptstraße 15",
    "city": "Hamburg",
    "postalCode": "20095",
    "country": "Germany"
  },
  "invoiceDate": "2024-03-05",
  "dueDate": "2024-04-04",
  "items": [
    {
      "description": "Energy audit - Multi-family building",
      "quantity": 1,
      "unitPrice": 2500.0,
      "total": 2500.0
    },
    {
      "description": "Consultation hours",
      "quantity": 6,
      "unitPrice": 150.0,
      "total": 900.0
    }
  ],
  "subtotal": 3400.0,
  "tax": 646.0,
  "total": 4046.0,
  "currency": "EUR",
  "status": "draft",
  "notes": "Draft invoice - pending final approval before sending."
}
