{
  "invoiceId": "INV-C3D4E5F6-3456-789A-BCDE-F01234567890",
  "invoiceNumber": "2024-0003",
  "customerName": "Müller Energietechnik",
  "customerEmail": "finanzen@mueller-energie.de",
  "customerAddress": {
    "street": "Industrieweg 23",
    "city": "Berlin",
    "postalCode": "10115",
    "country": "Germany"
  },
  "invoiceDate": "2023-12-10",
  "dueDate": "2024-01-09",
  "items": [
    {
      "description": "Battery storage system",
      "quantity": 2,
      "unitPrice": 6500.0,
      "total": 13000.0
    },
    {
      "description": "Installation service",
      "quantity": 12,
      "unitPrice": 95.0,
      "total": 1140.0
    }
  ],
  "subtotal": 14140.0,
  "tax": 2686.6,
  "total": 16826.6,
  "currency": "EUR",
  "status": "overdue",
  "notes": "OVERDUE: Payment was due on 2024-01-09. Please remit payment immediately."
}
